Name of movie,Year of release,Watchtime,Genre,Classification,Movie Rating,Metascore,Votes,Gross collection,Des,id,keywords,Link,img_src,Director,Stars
The Matrix Revolutions,2003,129,"Action, Sci-Fi",R,6.7,47.0,"541,630","427,344,325",The human city of Zion defends itself against the massive invasion of the machines as Neo fights to end the war at another front while also opposing the rogue Agent Smith.,605.0,"saving the world, artificial intelligence, man vs machine, flying, philosophy, fortune teller, kung fu, underground world, killer robot, temple, subway, dream, sun, hero, fight, sunlight, computer virus, key, future, precognition, super computer, machine town, ying yang, dying and death, virtual reality, dystopia, computer, faith, world religion, truth, rescue, mission, cyberpunk, woman director, yin yang, gnosticism",https://www.imdb.com/title/tt0242653/?ref_=ls_i_320,"https://m.media-amazon.com/images/M/MV5BMmNmMTEzODQtNmExMS00OGUxLWFkNTItMTM3NzBlNDk0YWU5XkEyXkFqcGc@._V1_QL75_UY207_CR0,0,140,207_.jpg",Lana Wachowski,"Keanu Reeves, Laurence Fishburne, Carrie-Anne Moss"
Scary Movie 3,2003,84,Comedy,PG-13,5.5,49.0,"157,783","220,673,217","Cindy must investigate mysterious crop circles and video tapes, and help the President in preventing an alien invasion.",4256.0,horror spoof,https://www.imdb.com/title/tt0306047/?ref_=ls_i_803,"https://m.media-amazon.com/images/M/MV5BNDE2NTIyMjg2OF5BMl5BanBnXkFtZTYwNDEyMTg3._V1_QL75_UX140_CR0,1,140,207_.jpg",David Zucker,"Anna Faris, Charlie Sheen, Regina Hall"
Anger Management,2003,106,Comedy,PG-13,6.2,52.0,"227,696","195,745,823","Dave Buznik is a businessman who is wrongly sentenced to an anger management program, where he meets an aggressive instructor.",9506.0,"penalty, therapist, psychology, aggression, rage, anger, anger management",https://www.imdb.com/title/tt0305224/?ref_=ls_i_941,"https://m.media-amazon.com/images/M/MV5BYjFmNjIyNmQtMDhmNS00NDNmLTk3YTQtM2YzMmJiMTI3MDMzXkEyXkFqcGc@._V1_QL75_UX140_CR0,1,140,207_.jpg",Peter Segal,"Jack Nicholson, Adam Sandler, Marisa Tomei"
The Lord of the Rings: The Return of the King,2003,201,"Action, Adventure, Drama",PG-13,9.0,94.0,"1,970,178","1,155,870,721",Gandalf and Aragorn lead the World of Men against Sauron's army to draw his gaze from Frodo and Sam as they approach Mount Doom with the One Ring.,122.0,"elves, orcs, middle-earth (tolkien), based on novel, suspicion, bravery, war, honor, troll, brutality, violence, ghost, end of trilogy, quest, sword and sorcery",https://www.imdb.com/title/tt0167260/?ref_=ls_i_31,"https://m.media-amazon.com/images/M/MV5BMTZkMjBjNWMtZGI5OC00MGU0LTk4ZTItODg2NWM3NTVmNWQ4XkEyXkFqcGc@._V1_QL75_UX140_CR0,0,140,207_.jpg",Peter Jackson,"Elijah Wood, Viggo Mortensen, Ian McKellen"
Men in Black II,2002,88,"Action, Adventure, Comedy",PG-13,6.2,49.0,"401,973","445,135,288",Agent J is sent to find Agent K and restore his memory after the re-appearance of a case from K's past.,608.0,"saving the world, secret identity, sun glasses, undercover, space marine, illegal immigration, deportation, new identity, flying saucer, light, firearm, alien, fictional government agency",https://www.imdb.com/title/tt0120912/?ref_=ls_i_301,"https://m.media-amazon.com/images/M/MV5BMTMxNDA0NTMxMV5BMl5BanBnXkFtZTYwMDE2NzY2._V1_QL75_UX140_CR0,0,140,207_.jpg",Barry Sonnenfeld,"Tommy Lee Jones, Will Smith, Rip Torn"
The Lord of the Rings: The Two Towers,2002,179,"Action, Adventure, Drama",PG-13,8.8,87.0,"1,776,156","948,734,205","While Frodo and Sam edge closer to Mordor with the help of the shifty Gollum, the divided fellowship makes a stand against Sauron's new ally, Saruman, and his hordes of Isengard.",121.0,"elves, orcs, middle-earth (tolkien), hobbit, based on novel, explosive, cave, fort, army, mission, attack, guide, wizard, ring, sword and sorcery",https://www.imdb.com/title/tt0167261/?ref_=ls_i_71,"https://m.media-amazon.com/images/M/MV5BMGQxMDdiOWUtYjc1Ni00YzM1LWE2NjMtZTg3Y2JkMjEzMTJjXkEyXkFqcGc@._V1_QL75_UX140_CR0,5,140,207_.jpg",Peter Jackson,"Elijah Wood, Ian McKellen, Viggo Mortensen"
Chicago,2002,113,"Comedy, Crime, Musical",PG-13,7.2,81.0,"242,684","306,776,732","Two death-row murderesses develop a fierce rivalry while competing for publicity, celebrity, and a sleazy lawyer's attention.",1574.0,"chicago, based on play or musical, prison matron, jazz age, nude man murdered",https://www.imdb.com/title/tt0299658/?ref_=ls_i_543,"https://m.media-amazon.com/images/M/MV5BNmJmZDEyNTctOTM1MS00NWEwLWFkMjctMjhhODEzMjU1MjA0XkEyXkFqcGc@._V1_QL75_UY207_CR0,0,140,207_.jpg",Rob Marshall,"Renée Zellweger, Catherine Zeta-Jones, Richard Gere"
Austin Powers in Goldmember,2002,94,"Action, Adventure, Comedy",PG-13,6.2,62.0,"222,259","296,938,801","Upon learning that his father has been kidnapped, Austin Powers must travel to 1975 and defeat the aptly named villain Goldmember, who is working with Dr. Evil.",818.0,"saving the world, submarine, brother brother relationship, clone, spy, helicopter, gold, submachine gun, asteroid, undercover, belgium, dutch, car journey, nightclub, laser, sumo ringer, family history, auto, clowning, overweight man, conciliation, james bond spoof, duringcreditsstinger",https://www.imdb.com/title/tt0295178/?ref_=ls_i_572,"https://m.media-amazon.com/images/M/MV5BYTUwYjI0YzctMGI5Yy00NGU5LTgwMGUtMzE1OWZhYmRlMjMyXkEyXkFqcGc@._V1_QL75_UX140_CR0,1,140,207_.jpg",Jay Roach,"Mike Myers, Beyoncé, Seth Green"
8 Mile,2002,110,"Drama, Music",R,7.2,77.0,"319,331","242,875,078","Follows a young rapper in the Detroit area, struggling with every aspect of his life, wants to make it big but his friends and foes make this odyssey of rap harder than it may seem.",65.0,"individual, street gang, adolescence, rap music, hip-hop, rhyme battle, trailer park, ethnic stereotype, single, detroit, eminem",https://www.imdb.com/title/tt0298203/?ref_=ls_i_720,"https://m.media-amazon.com/images/M/MV5BMzFhZDhjMDAtZWJlZS00ZWUyLWFlZGMtYTcwZjFlODcyMGE2XkEyXkFqcGc@._V1_QL75_UX140_CR0,0,140,207_.jpg",Curtis Hanson,"Eminem, Brittany Murphy, Kim Basinger"
My Big Fat Greek Wedding,2002,95,"Comedy, Drama, Romance",PG,6.6,62.0,"144,207","368,744,044",A young Greek woman falls in love with a non-Greek and struggles to get her family to accept him while she comes to terms with her heritage and cultural identity.,8346.0,"usa, parent child relationship, greece, culture clash, midlife crisis, restaurant, bad mother-in-law, mother-in-law, parents-in-law, son-in-law, father-in-law, patriarch, bad father-in-law, greek, wedding, family, xenophobia",https://www.imdb.com/title/tt0259446/?ref_=ls_i_412,"https://m.media-amazon.com/images/M/MV5BNWVmZmM3ZmUtNTU5ZS00ZmUxLTk0NDYtNWIxZjY4Zjk0MjQyXkEyXkFqcGc@._V1_QL75_UX140_CR0,1,140,207_.jpg",Joel Zwick,"Nia Vardalos, John Corbett, Michael Constantine"
Red Dragon,2002,124,"Crime, Drama, Thriller",R,7.2,60.0,"290,008","209,196,298","A retired FBI agent with psychological gifts is assigned to help track down ""The Tooth Fairy"", a mysterious serial killer. Aiding him is imprisoned forensic psychiatrist Dr. Hannibal ""The Cannibal"" Lecter.",9533.0,"psychopath, serial killer, fbi agent",https://www.imdb.com/title/tt0289765/?ref_=ls_i_869,"https://m.media-amazon.com/images/M/MV5BNmI0MDEwZTktMzdjMy00NDhmLWI2YjMtNGI4YjY0NDc3MDZkXkEyXkFqcGc@._V1_QL75_UX140_CR0,0,140,207_.jpg",Brett Ratner,"Anthony Hopkins, Edward Norton, Ralph Fiennes"
Harry Potter and the Chamber of Secrets,2002,161,"Adventure, Family, Fantasy",PG,7.4,63.0,"689,510","926,201,000",An ancient prophecy seems to be coming true when a mysterious presence begins stalking the corridors of a school of magic and leaving its victims paralyzed.,672.0,"flying car, witch, magic, cutting the cord, child hero, broom, sorcerer's apprentice, school of witchcraft, giant snake, black magic, aftercreditsstinger",https://www.imdb.com/title/tt0295297/?ref_=ls_i_79,"https://m.media-amazon.com/images/M/MV5BNGJhM2M2MWYtZjIzMC00MDZmLThkY2EtOWViMDhhYjRhMzk4XkEyXkFqcGc@._V1_QL75_UY207_CR2,0,140,207_.jpg",Chris Columbus,"Daniel Radcliffe, Rupert Grint, Emma Watson"
xXx,2002,124,"Action, Adventure, Thriller",PG-13,5.8,48.0,"186,137","277,448,382","The US government recruits extreme sports athlete Xander Cage to infiltrate a Russian criminal ring, which is plotting the destruction of the world.",7451.0,"sports car, biological weapon, cold war, russian, prague, mission, athlete, nsa agent, adrenaline junkie, thrill seeker",https://www.imdb.com/title/tt0295701/?ref_=ls_i_607,"https://m.media-amazon.com/images/M/MV5BNjY0MTc4ZDEtY2MxYi00ODIxLWJlNzQtZTlmZDVkYTYwM2NhXkEyXkFqcGc@._V1_QL75_UX140_CR0,0,140,207_.jpg",Rob Cohen,"Vin Diesel, Asia Argento, Marton Csokas"
Star Wars: Episode II - Attack of the Clones,2002,142,"Action, Adventure, Fantasy",PG,6.6,54.0,"756,058","653,779,970","Ten years after initially meeting, Anakin Skywalker shares a forbidden romance with Padmé Amidala, while Obi-Wan Kenobi discovers a secret clone army crafted for the Jedi.",1894.0,"senate, investigation, army, death star, jedi, cult figure, wedding, violence, kendo, laser gun, space opera, spaceport, teenage rebellion, good becoming evil, alien race, mechanical hand, yoda",https://www.imdb.com/title/tt0121765/?ref_=ls_i_165,"https://m.media-amazon.com/images/M/MV5BNTgxMjY2YzUtZmVmNC00YjAwLWJlODMtNDBhNzllNzIzMjgxXkEyXkFqcGc@._V1_QL75_UX140_CR0,2,140,207_.jpg",George Lucas,"Hayden Christensen, Natalie Portman, Ewan McGregor"
Ice Age,2002,81,"Animation, Adventure, Comedy",PG,7.5,61.0,"516,884","383,257,136","The story revolves around sub-zero heroes: a woolly mammoth, a saber-toothed tiger, a sloth and a prehistoric combination of a squirrel and rat, known as Scrat.",425.0,"human evolution, parent child relationship, squirrel, ice, loss of child, mammoth, sloth, dying and death, stone age, prehistoric, saber-toothed tiger, cavemen, prehistoric creature, prehistoric adventure, prehistoric times, prehistoric man",https://www.imdb.com/title/tt0268380/?ref_=ls_i_384,"https://m.media-amazon.com/images/M/MV5BODhmZTRjZWYtNGI5MC00YjgyLWFhODEtN2E4NTc2Zjg2ZmNmXkEyXkFqcGc@._V1_QL75_UX140_CR0,1,140,207_.jpg",Chris Wedge,"Denis Leary, John Leguizamo, Ray Romano"
The Bourne Identity,2002,119,"Action, Mystery, Thriller",PG-13,7.8,68.0,"574,588","214,034,224","A man is picked up by a fishing boat, bullet-riddled and suffering from amnesia, before racing to elude assassins and attempting to regain his memory.",2501.0,"paris, barcelona spain, assassin, based on novel, secret identity, amnesia, sniper, passport, mission of murder, lovers, escape, shootout, foot chase, cell phone, car chase, multiple identities, surveillance camera, hamburg germany, fishing boat, langley virginia, safe deposit box, flashback, hand to hand combat",https://www.imdb.com/title/tt0258463/?ref_=ls_i_842,"https://m.media-amazon.com/images/M/MV5BYTk1ZTcyMWMtMWUxYS00MmEzLTlmODYtOTk1MGRjOTg1ZjlmXkEyXkFqcGc@._V1_QL75_UX140_CR0,1,140,207_.jpg",Doug Liman,"Franka Potente, Matt Damon, Chris Cooper"
Catch Me If You Can,2002,141,"Biography, Crime, Drama",PG-13,8.1,75.0,"1,089,053","352,114,312","Barely 17 yet, Frank is a skilled forger who has passed as a doctor, lawyer and pilot. FBI agent Carl becomes obsessed with tracking down the con man, who only revels in the pursuit.",640.0,"con man, biography, fbi agent, overhead camera shot, attempted jailbreak, engagement party, mislaid trust, bank fraud, inspired by a true story",https://www.imdb.com/title/tt0264464/?ref_=ls_i_448,"https://m.media-amazon.com/images/M/MV5BMTY5MzYzNjc5NV5BMl5BanBnXkFtZTYwNTUyNTc2._V1_QL75_UX140_CR0,0,140,207_.jpg",Steven Spielberg,"Leonardo DiCaprio, Tom Hanks, Christopher Walken"
Signs,2002,106,"Drama, Mystery, Sci-Fi",PG-13,6.8,59.0,"384,465","408,247,917","A widowed former reverend living with his children and brother on a Pennsylvania farm finds mysterious crop circles in their fields, which suggests something more frightening to come.",2675.0,"symbolism, water, farm, faith, alien, family relationships, rural setting, alien invasion, crop circle, alien attack, loss of faith, alien encounter",https://www.imdb.com/title/tt0286106/?ref_=ls_i_345,"https://m.media-amazon.com/images/M/MV5BNDUwMDUyMDAyNF5BMl5BanBnXkFtZTYwMDQ3NzM3._V1_QL75_UX140_CR0,0,140,207_.jpg",M. Night Shyamalan,"Mel Gibson, Joaquin Phoenix, Rory Culkin"
Two Weeks Notice,2002,101,"Comedy, Romance",PG-13,6.1,42.0,"125,654","199,043,471","A lawyer decides that she's used too much like a nanny by her boss, so she walks out on him.",2642.0,"set, sammen",https://www.imdb.com/title/tt0313737/?ref_=ls_i_921,"https://m.media-amazon.com/images/M/MV5BMzNlMTBiNDctOGJmYS00ZTk2LTgwY2QtNjFmNTFlODIwYzYyXkEyXkFqcGc@._V1_QL75_UX140_CR0,1,140,207_.jpg",Marc Lawrence,"Sandra Bullock, Hugh Grant, Alicia Witt"
Lilo & Stitch,2002,85,"Animation, Adventure, Comedy",PG,7.3,74.0,"210,592","273,144,151","A young and parentless girl adopts a 'dog' from the local pound, completely unaware that it's supposedly a dangerous scientific experiment that's taken refuge on Earth and is now hiding from its creator and those who see it as a menace.",11544.0,"sister sister relationship, extraterrestrial technology, hawaii, adoption, mutation, alien life-form, alien phenomenons, animation, dog, dead parents",https://www.imdb.com/title/tt0275847/?ref_=ls_i_621,"https://m.media-amazon.com/images/M/MV5BYzRiYTA1YTEtMjYwMi00NGVhLThkOGYtZDBlYjNjZDk2NDEwXkEyXkFqcGc@._V1_QL75_UX140_CR0,0,140,207_.jpg",Dean DeBlois,"Daveigh Chase, Chris Sanders, Tia Carrere"
Scooby-Doo,2002,86,"Adventure, Comedy, Family",PG,5.3,35.0,"124,974","275,678,613","After an acrimonious break up, the Mystery Inc. gang are individually brought to an island resort to investigate strange goings on.",9637.0,"amateur detective, voodoo, resort, crime solving",https://www.imdb.com/title/tt0267913/?ref_=ls_i_612,"https://m.media-amazon.com/images/M/MV5BMTg4MzMzMTY0OF5BMl5BanBnXkFtZTYwNzM3MTg2._V1_QL75_UY207_CR0,0,140,207_.jpg",Raja Gosnell,"Matthew Lillard, Freddie Prinze Jr., Sarah Michelle Gellar"
Panic Room,2002,112,"Crime, Drama, Thriller",R,6.8,65.0,"295,982","197,079,546","A divorced woman and her diabetic daughter take refuge in their newly-purchased house's safe room when three men break-in, searching for a missing fortune.",4547.0,"burglar, bunker, housebreaking, safe, money",https://www.imdb.com/title/tt0258000/?ref_=ls_i_936,"https://m.media-amazon.com/images/M/MV5BODU0ZGM0MjctM2YxYy00OWY1LTk2N2YtNWE4ZWQ2ODQwMTI5XkEyXkFqcGc@._V1_QL75_UX140_CR0,0,140,207_.jpg",David Fincher,"Jodie Foster, Kristen Stewart, Forest Whitaker"
The Sum of All Fears,2002,124,"Action, Drama, Thriller",PG-13,6.4,45.0,"124,138","193,921,372","CIA analyst Jack Ryan must stop the plans of a Neo-Nazi faction that threatens to induce a catastrophic conflict between the United States and Russia's President by detonating a nuclear weapon at a football game in Baltimore, Maryland.",4614.0,"cia, terrorist, atomic bomb, cold war, nuclear explosion, jack ryan",https://www.imdb.com/title/tt0164184/?ref_=ls_i_950,"https://m.media-amazon.com/images/M/MV5BMDcyNGIyYWQtZDI2OS00YTU3LTg3OTItMDM2ZTIzZmFkMGYwXkEyXkFqcGc@._V1_QL75_UX140_CR0,0,140,207_.jpg",Phil Alden Robinson,"Ben Affleck, Morgan Freeman, Ian Mongrain"
Gangs of New York,2002,167,"Crime, Drama",R,7.5,72.0,"471,448","193,772,504","In 1862, Amsterdam Vallon returns to the Five Points area of New York City seeking revenge against Bill the Butcher, his father's killer.",3131.0,"fire, irish-american, immigrant, gang war, pickpocket, ship, gang of thieves, butcher, pig, army, rescue, gang",https://www.imdb.com/title/tt0217505/?ref_=ls_i_951,"https://m.media-amazon.com/images/M/MV5BMTQ0MDA0MTUtYzkzMi00NDY3LThhZDEtNGM4MWUwYzMyZDk5XkEyXkFqcGc@._V1_QL75_UY207_CR0,0,140,207_.jpg",Martin Scorsese,"Leonardo DiCaprio, Cameron Diaz, Daniel Day-Lewis"
The Ring,2002,115,"Horror, Mystery",PG-13,7.1,57.0,"373,641","249,348,933",A journalist must investigate a mysterious videotape which seems to cause the death of anyone one week to the day after they view it.,565.0,"journalist, drowning, island, television, horse, videoband, investigation, telephone, remake, paranormal, curse, cabin in the woods, ghost, well, videotape, supernatural horror, mysterious death, remake of asian film",https://www.imdb.com/title/tt0298130/?ref_=ls_i_695,"https://m.media-amazon.com/images/M/MV5BNDA2NTg2NjE4Ml5BMl5BanBnXkFtZTYwMjYxMDg5._V1_QL75_UY207_CR0,0,140,207_.jpg",Gore Verbinski,"Naomi Watts, Martin Henderson, Brian Cox"
Spider-Man,2002,121,"Action, Adventure, Sci-Fi",PG-13,7.4,73.0,"875,604","825,025,036","After being bitten by a genetically-modified spider, a shy teenager gains spider-like abilities that he uses to fight injustice as a masked superhero and face a vengeful enemy.",557.0,"loss of lover, spider, thanksgiving, bad boss, hostility, marvel comic, superhero, pokies, evil, reference to superman, goblin",https://www.imdb.com/title/tt0145487/?ref_=ls_i_97,"https://m.media-amazon.com/images/M/MV5BZWM0OWVmNTEtNWVkOS00MzgyLTkyMzgtMmE2ZTZiNjY4MmFiXkEyXkFqcGc@._V1_QL75_UY207_CR0,0,140,207_.jpg",Sam Raimi,"Tobey Maguire, Kirsten Dunst, Willem Dafoe"
Minority Report,2002,145,"Action, Crime, Mystery",PG-13,7.6,80.0,"582,596","358,372,926","John works with the PreCrime police which stop crimes before they take place, with the help of three 'PreCogs' who can foresee crimes. Events ensue when John finds himself framed for a future murder.",180.0,"self-fulfilling prophecy, washington d.c., evidence, future, hologram, dystopia, murder, neo-noir, future noir",https://www.imdb.com/title/tt0181689/?ref_=ls_i_433,"https://m.media-amazon.com/images/M/MV5BYTdmNzM3YzItZTRkYS00MTY5LTg4ZmItNjFmNTk2N2Q2NmNlXkEyXkFqcGc@._V1_QL75_UX140_CR0,1,140,207_.jpg",Steven Spielberg,"Tom Cruise, Colin Farrell, Samantha Morton"
Die Another Day,2002,133,"Action, Adventure, Thriller",PG-13,6.1,56.0,"228,701","431,971,116","James Bond is sent to investigate the connection between a North Korean terrorist and a diamond mogul, who is funding the development of an international space weapon.",36669.0,"laser, british secret service, secret service agent, space based weapon",https://www.imdb.com/title/tt0246460/?ref_=ls_i_315,"https://m.media-amazon.com/images/M/MV5BNDZiYWFmOTQtMTQ5Yy00MzA3LWFlNzktZTVmMGQ1MDA4MjEyXkEyXkFqcGc@._V1_QL75_UX140_CR0,0,140,207_.jpg",Lee Tamahori,"Pierce Brosnan, Halle Berry, Rosamund Pike"
Planet of the Apes,2001,120,"Action, Adventure, Sci-Fi",PG-13,5.7,50.0,"228,272","362,211,740","In 2029, an Air Force astronaut crash-lands on a mysterious planet where evolved, talking apes dominate a race of primitive humans.",869.0,"gorilla, space marine, space suit, revolution, chimp, slavery, space travel, time travel, dystopia, alien planet, ape, human subjugation",https://www.imdb.com/title/tt0133152/?ref_=ls_i_424,"https://m.media-amazon.com/images/M/MV5BYjczODRhOTQtZjdkYi00MmM2LTg1ZmEtZDQ3YjA5MDJhODNhXkEyXkFqcGc@._V1_QL75_UX140_CR0,1,140,207_.jpg",Tim Burton,"Mark Wahlberg, Helena Bonham Carter, Tim Roth"
Pearl Harbor,2001,183,"Action, Drama, Romance",PG-13,6.2,44.0,"350,858","449,220,945",A tale of war and romance mixed in with history. The story follows two lifelong friends and a beautiful nurse who are caught up in the horror of an infamous Sunday morning in 1941.,676.0,"nurse, patriotism, hawaii, world war ii, pilot, pearl harbor, u.s. air force, airplane, war, army, love, pin-up",https://www.imdb.com/title/tt0213149/?ref_=ls_i_299,"https://m.media-amazon.com/images/M/MV5BMTQ3MDc0MDc1NF5BMl5BanBnXkFtZTYwODI1ODY2._V1_QL75_UY207_CR0,0,140,207_.jpg",Michael Bay,"Ben Affleck, Kate Beckinsale, Josh Hartnett"
The Mummy Returns,2001,130,"Action, Adventure, Fantasy",PG-13,6.4,48.0,"344,790","443,280,904","The mummified body of Imhotep is shipped to a museum in London, where he once again wakes and begins his campaign of rage and terror.",1734.0,"son, ancient egypt, bracelet",https://www.imdb.com/title/tt0209163/?ref_=ls_i_303,"https://m.media-amazon.com/images/M/MV5BMjdiYzVlNjUtNGI5MC00MDE5LTk0MmQtNDc0YzIzOGRmMDNkXkEyXkFqcGc@._V1_QL75_UX140_CR0,0,140,207_.jpg",Stephen Sommers,"Brendan Fraser, Rachel Weisz, John Hannah"
Spirited Away,2001,125,"Animation, Adventure, Family",PG,8.6,96.0,"844,037","357,277,400","During her family's move to the suburbs, a sullen 10-year-old girl wanders into a world ruled by gods, witches and spirits, a world where humans are changed into beasts.",129.0,"witch, parent child relationship, magic, darkness, bath house, ghost world, parallel world, amusement park, youkai, japanese mythology, anime, spirits",https://www.imdb.com/title/tt0245429/?ref_=ls_i_434,"https://m.media-amazon.com/images/M/MV5BNTEyNmEwOWUtYzkyOC00ZTQ4LTllZmUtMjk0Y2YwOGUzYjRiXkEyXkFqcGc@._V1_QL75_UX140_CR0,0,140,207_.jpg",Hayao Miyazaki,"Daveigh Chase, Suzanne Pleshette, Miyu Irino"
Hannibal,2001,131,"Crime, Drama, Thriller",R,6.8,57.0,"292,226","351,692,268","Living in exile, Dr. Hannibal Lecter tries to reconnect with now disgraced F.B.I. Agent Clarice Starling, and finds himself a target for revenge from a powerful victim.",9740.0,"venice, brain, suspense, serial killer, fbi agent, aftercreditsstinger",https://www.imdb.com/title/tt0212985/?ref_=ls_i_450,"https://m.media-amazon.com/images/M/MV5BYTk3NGUzOWYtNTU5Yy00ZDNjLTg1YzItZDlmNWRhMmVlZTMxXkEyXkFqcGc@._V1_QL75_UY207_CR2,0,140,207_.jpg",Ridley Scott,"Anthony Hopkins, Julianne Moore, Gary Oldman"
A Beautiful Mind,2001,135,"Biography, Drama, Mystery",PG-13,8.2,72.0,"983,596","316,791,257","A mathematical genius, John Nash made an astonishing discovery early in his career and stood on the brink of international acclaim. But the handsome and arrogant Nash soon found himself on a harrowing journey of self-discovery.",453.0,"individual, schizophrenia, massachusetts, love of one's life, intelligence, mathematician, market economy, economic theory, princeton university, nobel prize, mathematical theorem, m.i.t., mathematics, delusion",https://www.imdb.com/title/tt0268978/?ref_=ls_i_520,"https://m.media-amazon.com/images/M/MV5BNzljZTk5ZDgtZTQ1Zi00NTM4LThlOGUtZDk2MGM4NDQ4NWQyXkEyXkFqcGc@._V1_QL75_UX140_CR0,0,140,207_.jpg",Ron Howard,"Russell Crowe, Ed Harris, Jennifer Connelly"
Rush Hour 2,2001,90,"Action, Comedy, Crime",PG-13,6.7,48.0,"238,036","347,325,802","Carter and Lee head to Hong Kong for a vacation, but become embroiled in a counterfeit money scam.",5175.0,duringcreditsstinger,https://www.imdb.com/title/tt0266915/?ref_=ls_i_463,"https://m.media-amazon.com/images/M/MV5BMGM0OTM4NGYtYzkzMC00OGZmLWEwZTItOTg4ZTdkYTIxOTc0XkEyXkFqcGc@._V1_QL75_UX140_CR0,0,140,207_.jpg",Brett Ratner,"Jackie Chan, Chris Tucker, John Lone"
Bridget Jones's Diary,2001,97,"Comedy, Drama, Romance",R,6.8,66.0,"262,471","334,272,563",Bridget Jones is determined to improve herself while she looks for love in a year in which she keeps a personal diary.,634.0,"holiday, london england, england, alcohol, sex, lovesickness, telecaster, birthday, christmas party, news broadcast, sexual frustration, diary, cigarette, daughter, mother daughter relationship, lawyer, reporter, extramarital affair, duringcreditsstinger, woman director, christmas",https://www.imdb.com/title/tt0243155/?ref_=ls_i_484,"https://m.media-amazon.com/images/M/MV5BNTM1MTFiNDEtMGYzZC00MjM5LWEwMWMtN2VhNjg1MTEzOTg3XkEyXkFqcGc@._V1_QL75_UX140_CR0,0,140,207_.jpg",Sharon Maguire,"Renée Zellweger, Colin Firth, Hugh Grant"
Ocean's Eleven,2001,116,"Crime, Thriller",PG-13,7.7,74.0,"616,301","450,717,150",Danny Ocean and his ten accomplices plan to rob three Las Vegas casinos simultaneously.,161.0,"prison, pickpocket, strip club, con artist, atlantic city, cockney accent, las vegas, card dealer, explosives expert, black and white scene, male, salt lake city utah",https://www.imdb.com/title/tt0240772/?ref_=ls_i_295,"https://m.media-amazon.com/images/M/MV5BMmNhZDkxYTgtMDM3ZC00NTQ3LWFjZTUtNzc1Y2QyNWZjNDRmXkEyXkFqcGc@._V1_QL75_UX140_CR0,0,140,207_.jpg",Steven Soderbergh,"George Clooney, Brad Pitt, Julia Roberts"
Harry Potter and the Sorcerer's Stone,2001,152,"Adventure, Family, Fantasy",PG,7.6,65.0,"852,779","1,024,254,401","An orphaned boy enrolls in a school of wizardry, where he learns the truth about himself, his family and the terrible evil that haunts the magical world.",,"flying, traitor, magic, cutting the cord, child hero, broom, sorcerer's apprentice, school of witchcraft, griffon, black magic, time travel, best friend, werewolf, dark, muggle, aftercreditsstinger",https://www.imdb.com/title/tt0241527/?ref_=ls_i_52,"https://m.media-amazon.com/images/M/MV5BNTU1MzgyMDMtMzBlZS00YzczLThmYWEtMjU3YmFlOWEyMjE1XkEyXkFqcGc@._V1_QL75_UY207_CR1,0,140,207_.jpg",Chris Columbus,"Daniel Radcliffe, Rupert Grint, Emma Watson"
Jurassic Park III,2001,92,"Action, Adventure, Sci-Fi",PG-13,5.9,42.0,"339,912","368,780,809","A decidedly odd couple with ulterior motives convince Dr. Grant to go to Isla Sorna for a holiday, but their unexpected landing startles the island's new inhabitants.",331.0,"exotic island, dna, paleontology, tyrannosaurus rex, velociraptor, spinosaurus, airplane, rescue, mission, dinosaur, jurassic park",https://www.imdb.com/title/tt0163025/?ref_=ls_i_411,"https://m.media-amazon.com/images/M/MV5BN2FmMjhlZDYtNmYyMy00NTdjLTlhYzYtZWNlMDY2MmUzOGM2XkEyXkFqcGc@._V1_QL75_UY207_CR0,0,140,207_.jpg",Joe Johnston,"Sam Neill, William H. Macy, Téa Leoni"
Cats & Dogs,2001,87,"Action, Adventure, Comedy",PG,5.1,47.0,"62,426","200,687,492","A look at the top-secret, high-tech espionage war going on between cats and dogs, of which their human owners are blissfully unaware.",10992.0,"fight, governance, puppy, allergy, 3d",https://www.imdb.com/title/tt0239395/?ref_=ls_i_917,"https://m.media-amazon.com/images/M/MV5BMDEyYmE5MWMtNzg3Ny00NmVjLWJmZTUtMmUyOTliNDRiMDk2XkEyXkFqcGc@._V1_QL75_UX140_CR0,1,140,207_.jpg",Lawrence Guterman,"Alec Baldwin, Tobey Maguire, Jeff Goldblum"
