Name of movie,Year of release,Watchtime,Genre,Classification,Movie Rating,Metascore,Votes,Gross collection,Des,id,keywords,Link,img_src,Director,Stars
Suicide Squad,2016,123,"Action, Adventure, Fantasy",PG-13,5.9,40.0,"720,482","749,200,054",A secret government agency recruits some of the most dangerous incarcerated super-villains to form a defensive task force. Their first mission: save the world from the apocalypse.,297761.0,"dc comics, shared universe, anti hero, secret mission, villain, superhero, supervillain, dc extended universe",https://www.imdb.com/title/tt1386697/?ref_=ls_i_127,"https://m.media-amazon.com/images/M/MV5BMjM1OTMxNzUyM15BMl5BanBnXkFtZTgwNjYzMTIzOTE@._V1_QL75_UX140_CR0,0,140,207_.jpg",David Ayer,"Will Smith, Jared Leto, Margot Robbie"
Doctor Strange,2016,115,"Action, Adventure, Fantasy",PG-13,7.5,72.0,"801,419","677,796,076","While on a journey of physical and spiritual healing, a brilliant neurosurgeon is drawn into the world of the mystic arts.",284052.0,"magic, marvel comic, superhero, based on comic, sorcerer, doctor, neurosurgeon, wizard, aftercreditsstinger, duringcreditsstinger, marvel cinematic universe",https://www.imdb.com/title/tt1211837/?ref_=ls_i_154,"https://m.media-amazon.com/images/M/MV5BNjgwNzAzNjk1Nl5BMl5BanBnXkFtZTgwMzQ2NjI1OTE@._V1_QL75_UX140_CR0,0,140,207_.jpg",Scott Derrickson,"Benedict Cumberbatch, Chiwetel Ejiofor, Rachel McAdams"
Central Intelligence,2016,107,"Action, Comedy, Crime",PG-13,6.3,52.0,"212,108","216,940,871","After he reconnects with an awkward pal from high school through Facebook, a mild-mannered accountant is lured into the world of international espionage.",302699.0,"spy, cia, espionage, high school reunion, reference to facebook, accountant",https://www.imdb.com/title/tt1489889/?ref_=ls_i_821,"https://m.media-amazon.com/images/M/MV5BMjA2NzEzNjIwNl5BMl5BanBnXkFtZTgwNzgwMTEzNzE@._V1_QL75_UX140_CR0,0,140,207_.jpg",Rawson Marshall Thurber,"Dwayne Johnson, Kevin Hart, Danielle Nicolet"
Your Name.,2016,106,"Animation, Drama, Fantasy",PG,8.4,81.0,"316,972","382,238,181","Two teenagers share a profound, magical connection upon discovering they are swapping bodies. Things manage to become even more complicated when the boy and girl decide to meet in person.",372058.0,"supernatural, romance, school, star crossed lovers, anime, body switching",https://www.imdb.com/title/tt5311514/?ref_=ls_i_385,"https://m.media-amazon.com/images/M/MV5BMjI1ODZkYTgtYTY3Yy00ZTJkLWFkOTgtZDUyYWM4MzQwNjk0XkEyXkFqcGc@._V1_QL75_UX140_CR0,0,140,207_.jpg",Makoto Shinkai,"Ryunosuke Kamiki, Mone Kamishiraishi, Ryo Narita"
Dangal,2016,161,"Action, Biography, Drama",Not Rated,8.3,,"209,323","303,723,636",Former wrestler Mahavir Singh Phogat and his two wrestler daughters struggle towards glory at the Commonwealth Games in the face of societal oppression.,360814.0,"biography, wrestling, sport, autobiography",https://www.imdb.com/title/tt5074352/?ref_=ls_i_548,"https://m.media-amazon.com/images/M/MV5BMTQ4MzQzMzM2Nl5BMl5BanBnXkFtZTgwMTQ1NzU3MDI@._V1_QL75_UY207_CR4,0,140,207_.jpg",Nitesh Tiwari,"Aamir Khan, Sakshi Tanwar, Fatima Sana Shaikh"
Moana,2016,107,"Animation, Adventure, Comedy",PG,7.6,81.0,"375,600","687,228,908","In ancient Polynesia, when a terrible curse incurred by the demigod Maui reaches Moana's island, she answers the Ocean's call to seek out Maui to set things right.",277834.0,"ocean, sailboat, mythology, island, musical, animation, curse, young girl, sailor, aftercreditsstinger, demigod, polynesia, voyage, pacific  ocean, quest, maui, animal sidekick",https://www.imdb.com/title/tt3521164/?ref_=ls_i_167,"https://m.media-amazon.com/images/M/MV5BMjI4MzU5NTExNF5BMl5BanBnXkFtZTgwNzY1MTEwMDI@._V1_QL75_UX140_CR0,0,140,207_.jpg",Ron Clements,"Auli'i Cravalho, Dwayne Johnson, Rachel House"
Teenage Mutant Ninja Turtles: Out of the Shadows,2016,112,"Action, Adventure, Comedy",PG-13,5.9,40.0,"99,556","245,623,848","The Turtles get into another battle with their enemy the Shredder, who has acquired new allies: the mutant thugs Bebop and Rocksteady and the alien being Krang.",308531.0,"brother brother relationship, turtle, sequel, based on comic, ninja, rat",https://www.imdb.com/title/tt3949660/?ref_=ls_i_706,"https://m.media-amazon.com/images/M/MV5BZDgyNWExMzUtOTAyMy00ZjkzLWFhNzgtZTFhOTBmN2RhZGJhXkEyXkFqcGc@._V1_QL75_UX140_CR0,1,140,207_.jpg",Dave Green,"Megan Fox, Will Arnett, Tyler Perry"
Passengers,2016,116,"Drama, Romance, Sci-Fi",PG-13,7.0,41.0,"444,770","303,144,152",A malfunction in a sleeping pod on a spacecraft traveling to a distant colony planet wakes one passenger 90 years early.,274870.0,"male nudity, android, asteroid, isolation, shower, nudity, automation, hibernation, swimming pool, spaceship, space, outer space, robot, space station, lying, gravity, trapped in space, malfunction, 3d",https://www.imdb.com/title/tt1355644/?ref_=ls_i_549,"https://m.media-amazon.com/images/M/MV5BYzRjNTFmMzQtM2JhZi00ZTI0LTlhMjMtNzQ4YWRhZGVmZWRmXkEyXkFqcGc@._V1_QL75_UX140_CR0,0,140,207_.jpg",Morten Tyldum,"Jennifer Lawrence, Chris Pratt, Michael Sheen"
Ghostbusters,2016,117,"Action, Comedy, Fantasy",PG-13,6.8,60.0,"244,539","229,147,509","Following a ghost invasion of Manhattan, paranormal enthusiasts Erin Gilbert and Abby Yates, nuclear engineer Jillian Holtzmann, and subway worker Patty Tolan band together to stop the otherworldly threat.",43074.0,"female friendship, ghost hunting, reboot, ghost",https://www.imdb.com/title/tt0087332/?ref_=ls_i_573,"https://m.media-amazon.com/images/M/MV5BMGI0Yjg2ODAtNDYzNi00Njc2LTlkMmMtMmRmYWI5MDE4ZGRkXkEyXkFqcGc@._V1_QL75_UX140_CR0,0,140,207_.jpg",Ivan Reitman,"Bill Murray, Dan Aykroyd, Sigourney Weaver"
Ghostbusters,2016,117,"Action, Comedy, Fantasy",PG-13,6.8,60.0,"244,539","229,147,509","Following a ghost invasion of Manhattan, paranormal enthusiasts Erin Gilbert and Abby Yates, nuclear engineer Jillian Holtzmann, and subway worker Patty Tolan band together to stop the otherworldly threat.",43074.0,"female friendship, ghost hunting, reboot, ghost",https://www.imdb.com/title/tt1289401/?ref_=ls_i_766,"https://m.media-amazon.com/images/M/MV5BZjNhMzU5MjgtY2VhMC00NzZmLTk1YTEtMDc5OGU1OWJiMTE4XkEyXkFqcGc@._V1_QL75_UX140_CR0,0,140,207_.jpg",Paul Feig,"Melissa McCarthy, Kristen Wiig, Kate McKinnon"
Jason Bourne,2016,123,"Action, Thriller",PG-13,6.6,58.0,"241,345","415,484,914",The CIA's most dangerous former operative is drawn out of hiding to uncover more explosive truths about his past.,324668.0,"assassin, amnesia, flashback",https://www.imdb.com/title/tt4196776/?ref_=ls_i_332,"https://m.media-amazon.com/images/M/MV5BMzY3Y2Q3MmUtZmU3MC00OWMxLWIwNDMtNDA4MmViMTUxYjYxXkEyXkFqcGc@._V1_QL75_UX140_CR0,2,140,207_.jpg",Paul Greengrass,"Matt Damon, Tommy Lee Jones, Alicia Vikander"
The BFG,2016,117,"Adventure, Family, Fantasy",PG,6.3,66.0,"92,956","195,243,411","An orphan little girl befriends a benevolent giant who takes her to Giant Country, where they attempt to stop the man-eating giants that are invading the human world.",267935.0,"london england, england, based on novel, queen, little girl, orphan, cannibal, giant, evil brother",https://www.imdb.com/title/tt3691740/?ref_=ls_i_946,"https://m.media-amazon.com/images/M/MV5BNjAzOTUzNTY3Ml5BMl5BanBnXkFtZTgwMjYwNzE5ODE@._V1_QL75_UX140_CR0,0,140,207_.jpg",Steven Spielberg,"Mark Rylance, Ruby Barnhill, Penelope Wilton"
Sing,2016,108,"Animation, Comedy, Family",PG,7.1,59.0,"190,199","634,338,384","In a city of humanoid animals, a hustling theater impresario's attempt to save his theater with a singing competition becomes grander than he anticipates even as its finalists find that their lives will never be the same.",335797.0,"cgi, furry, talking animal, anthropomorphism, singing, theater, singing competition",https://www.imdb.com/title/tt3470600/?ref_=ls_i_169,"https://m.media-amazon.com/images/M/MV5BMTYzODYzODU2Ml5BMl5BanBnXkFtZTgwNTc1MTA2NzE@._V1_QL75_UX140_CR0,0,140,207_.jpg",Garth Jennings,"Matthew McConaughey, Reese Witherspoon, Seth MacFarlane"
Assassin's Creed,2016,115,"Action, Adventure, Sci-Fi",PG-13,5.6,36.0,"208,378","240,697,856","Callum Lynch explores the memories of his ancestor Aguilar de Nerha and gains the skills of a Master Assassin, before taking on the secret Templar society.",121856.0,"assassination, spain, assassin, secret society, brotherhood, chase, parkour, memory, religion, based on video game, corporate conspiracy, genetic memory",https://www.imdb.com/title/tt2094766/?ref_=ls_i_725,"https://m.media-amazon.com/images/M/MV5BMTU2Mjc1ODY2OV5BMl5BanBnXkFtZTgwNTMzMTYzMDI@._V1_QL75_UX140_CR0,0,140,207_.jpg",Justin Kurzel,"Michael Fassbender, Marion Cotillard, Jeremy Irons"
Star Trek Beyond,2016,122,"Action, Adventure, Sci-Fi",PG-13,7.0,68.0,"257,894","343,471,816","The crew of the USS Enterprise explores the furthest reaches of uncharted space, where they encounter a new ruthless enemy, who puts them, and everything the Federation stands for, to the test.",188927.0,"sequel, stranded, hatred, space opera",https://www.imdb.com/title/tt2660888/?ref_=ls_i_468,"https://m.media-amazon.com/images/M/MV5BN2FhNDI1YTYtNWI0OC00ZjYxLWJlYWEtN2ZiZjRmZDY1MWJjXkEyXkFqcGc@._V1_QL75_UX140_CR0,0,140,207_.jpg",Justin Lin,"Chris Pine, Zachary Quinto, Karl Urban"
Split,2016,117,"Horror, Thriller",PG-13,7.3,63.0,"547,548","278,454,417",Three girls are kidnapped by a man with a diagnosed 23 distinct personalities. They must try to escape before the apparent emergence of a frightful new 24th.,381288.0,"child abuse, kidnapping, gore, stalking, teenage girl, blood, violence, mental illness, super powers, multiple personality, traumatic childhood, dissociative identity disorder",https://www.imdb.com/title/tt4972582/?ref_=ls_i_605,"https://m.media-amazon.com/images/M/MV5BNTZjNmVjMzAtZjg2Mi00MWNmLTk5NTItOTExZDYwNTE2YmExXkEyXkFqcGc@._V1_QL75_UX140_CR0,0,140,207_.jpg",M. Night Shyamalan,"James McAvoy, Anya Taylor-Joy, Haley Lu Richardson"
Batman v Superman: Dawn of Justice,2016,151,"Action, Adventure, Sci-Fi",PG-13,6.5,44.0,"750,769","874,362,803",Batman is manipulated by Lex Luthor to fear Superman. Superman´s existence is meanwhile dividing the world and he is framed for murder during an international crisis. The heroes clash and force the neutral Wonder Woman to reemerge.,209112.0,"dc comics, vigilante, superhero, based on comic, revenge, super powers, clark kent, bruce wayne, dc extended universe",https://www.imdb.com/title/tt2975590/?ref_=ls_i_84,"https://m.media-amazon.com/images/M/MV5BZTJkYjdmYjYtOGMyNC00ZGU1LThkY2ItYTc1OTVlMmE2YWY1XkEyXkFqcGc@._V1_QL75_UX140_CR0,0,140,207_.jpg",Zack Snyder,"Ben Affleck, Henry Cavill, Amy Adams"
La La Land,2016,128,"Comedy, Drama, Music",PG-13,8.0,94.0,"665,778","471,981,681","While navigating their careers in Los Angeles, a pianist and an actress fall in love while attempting to reconcile their aspirations for the future.",313369.0,"jazz, dance, passion, musical, casting, los angeles, pianist, theater, movie set, actress",https://www.imdb.com/title/tt3783958/?ref_=ls_i_241,"https://m.media-amazon.com/images/M/MV5BMzUzNDM2NzM2MV5BMl5BanBnXkFtZTgwNTM3NTg4OTE@._V1_QL75_UX140_CR0,0,140,207_.jpg",Damien Chazelle,"Ryan Gosling, Emma Stone, Rosemarie DeWitt"
London Has Fallen,2016,99,"Action, Thriller",R,5.9,28.0,"169,060","205,754,447","In London for the Prime Minister's funeral, Mike Banning is caught up in a plot to assassinate all the attending world leaders.",267860.0,"london england, terrorist, terrorist attack",https://www.imdb.com/title/tt3300542/?ref_=ls_i_887,"https://m.media-amazon.com/images/M/MV5BMTY1ODY2MTgwM15BMl5BanBnXkFtZTgwOTY3Nzc3NzE@._V1_QL75_UX140_CR0,0,140,207_.jpg",Babak Najafi,"Gerard Butler, Aaron Eckhart, Morgan Freeman"
Inferno,2016,121,"Action, Adventure, Crime",PG-13,6.2,42.0,"189,161","220,021,259","When Robert Langdon wakes up in an Italian hospital with amnesia, he teams up with Dr. Sienna Brooks and they race across Europe together against the clock to foil a deadly global plot.",207932.0,"italy, based on novel, europe, amnesia, book, sequel, murder, religion, symbology",https://www.imdb.com/title/tt3062096/?ref_=ls_i_806,"https://m.media-amazon.com/images/M/MV5BMTUzNTE2NTkzMV5BMl5BanBnXkFtZTgwMDAzOTUyMDI@._V1_QL75_UX140_CR0,0,140,207_.jpg",Ron Howard,"Tom Hanks, Felicity Jones, Irrfan Khan"
The Jungle Book,2016,106,"Animation, Action, Adventure",PG,7.4,77.0,"291,334","967,724,775","After a threat from the tiger Shere Khan forces him to flee the jungle, a man-cub named Mowgli embarks on a journey of self discovery with the help of panther Bagheera and free-spirited bear Baloo.",278927.0,"based on novel, snake, wolf, elephant, tiger, feral child, panther, remake, bear, jungle, talking animal, orphan, animal, talking to animals",https://www.imdb.com/title/tt3040964/?ref_=ls_i_59,"https://m.media-amazon.com/images/M/MV5BMTc3NTUzNTI4MV5BMl5BanBnXkFtZTgwNjU0NjU5NzE@._V1_QL75_UX140_CR0,0,140,207_.jpg",Jon Favreau,"Neel Sethi, Bill Murray, Ben Kingsley"
The Jungle Book,2016,106,"Animation, Action, Adventure",PG,7.4,77.0,"291,334","967,724,775","After a threat from the tiger Shere Khan forces him to flee the jungle, a man-cub named Mowgli embarks on a journey of self discovery with the help of panther Bagheera and free-spirited bear Baloo.",278927.0,"based on novel, snake, wolf, elephant, tiger, feral child, panther, remake, bear, jungle, talking animal, orphan, animal, talking to animals",https://www.imdb.com/title/tt0061852/?ref_=ls_i_885,"https://m.media-amazon.com/images/M/MV5BNGE4M2NiZDktY2E2MC00ZTY5LWIyMDktZWIxNzQ2OWU2NmQzXkEyXkFqcGc@._V1_QL75_UX140_CR0,1,140,207_.jpg",Wolfgang Reitherman,"Phil Harris, Sebastian Cabot, Louis Prima"
The Great Wall,2016,103,"Action, Adventure, Fantasy",PG-13,5.9,42.0,"145,636","334,933,831","In ancient China, a group of European mercenaries encounters a secret army that maintains and defends the Great Wall of China against a horde of monstrous creatures.",311324.0,"china, monster, archer, female soldier, explosion, period drama, british soldier, great wall of china, 3d, 15th century, female general",https://www.imdb.com/title/tt2034800/?ref_=ls_i_481,"https://m.media-amazon.com/images/M/MV5BMjA3MjAzOTQxNF5BMl5BanBnXkFtZTgwOTc5OTY1OTE@._V1_QL75_UX140_CR0,7,140,207_.jpg",Yimou Zhang,"Matt Damon, Tian Jing, Willem Dafoe"
Hidden Figures,2016,127,"Biography, Drama, History",PG,7.8,74.0,"254,087","235,956,898",The story of a team of female African-American mathematicians who served a vital role in NASA during the early years of the U.S. space program.,381284.0,"nasa, sexism, biography, mathematics, racial segregation, racism, scientist, space race, black woman, u.s. space program, discrimination, 1960s",https://www.imdb.com/title/tt4846340/?ref_=ls_i_742,"https://m.media-amazon.com/images/M/MV5BY2RhNDRhNzctZTllMy00NTc2LWJjZmUtMzg3MTNiNjhhODMxXkEyXkFqcGc@._V1_QL75_UX140_CR0,0,140,207_.jpg",Theodore Melfi,"Taraji P. Henson, Octavia Spencer, Janelle Monáe"
Arrival,2016,116,"Drama, Mystery, Sci-Fi",PG-13,7.9,81.0,"765,077","203,388,186",A linguist works with the military to communicate with alien lifeforms after twelve mysterious spacecraft appear around the world.,329865.0,"spacecraft, language, loss, romance, alien, female protagonist, scientist, family, heartbreak, based on short story, nonlinear timeline, military, alien language, linguist, first contact, communication, linguistics",https://www.imdb.com/title/tt2543164/?ref_=ls_i_871,"https://m.media-amazon.com/images/M/MV5BMTExMzU0ODcxNDheQTJeQWpwZ15BbWU4MDE1OTI4MzAy._V1_QL75_UX140_CR0,6,140,207_.jpg",Denis Villeneuve,"Amy Adams, Jeremy Renner, Forest Whitaker"
Now You See Me 2,2016,129,"Action, Adventure, Comedy",PG-13,6.4,46.0,"319,524","334,897,606","The Four Horsemen resurface, and are forcibly recruited by a tech genius to pull off their most impossible heist yet.",291805.0,"london england, china, magic, secret society, vigilante, sequel, revenge, heist, on the run, macau china, magician",https://www.imdb.com/title/tt3110958/?ref_=ls_i_482,"https://m.media-amazon.com/images/M/MV5BOTVjNTA0ZWEtNzU2Ny00Njg1LWE1MmEtZTUyZGQzYTVlY2Q5XkEyXkFqcGc@._V1_QL75_UX140_CR0,2,140,207_.jpg",Jon M. Chu,"Jesse Eisenberg, Mark Ruffalo, Woody Harrelson"
Kung Fu Panda 3,2016,95,"Animation, Action, Adventure",PG,7.1,66.0,"185,824","521,170,825","Continuing his ""legendary adventures of awesomeness"", Po must face two hugely epic, but different threats: one supernatural and the other a little closer to home.",140300.0,"china, martial arts, kung fu, village, panda, sequel, talking animal, anthropomorphism, dragon, ancient china, wuxia, woman director",https://www.imdb.com/title/tt2267968/?ref_=ls_i_238,"https://m.media-amazon.com/images/M/MV5BMTUyNzgxNjg2M15BMl5BanBnXkFtZTgwMTY1NDI1NjE@._V1_QL75_UX140_CR0,0,140,207_.jpg",Alessandro Carloni,"Jack Black, Bryan Cranston, Dustin Hoffman"
The Secret Life of Pets,2016,86,"Animation, Adventure, Comedy",PG,6.5,61.0,"216,547","894,328,469","The quiet life of a terrier named Max is upended when his owner takes in Duke, a stray whom Max instantly dislikes.",328111.0,"pet, bunny, anthropomorphism, dog, animal, apartment building, sewer, terrier, manhattan, new york city, rodent, mongrel",https://www.imdb.com/title/tt2709768/?ref_=ls_i_83,"https://m.media-amazon.com/images/M/MV5BMjIzMzA1OTkzNV5BMl5BanBnXkFtZTgwODE3MjM4NzE@._V1_QL75_UX140_CR0,7,140,207_.jpg",Chris Renaud,"Louis C.K., Eric Stonestreet, Kevin Hart"
The Monkey King 2,2016,119,"Action, Adventure, Fantasy",Not Rated,5.9,,"3,450","193,678,298","When a travelling monk is stranded in a wasteland, The Monkey King must escort him across the land to retrieve sacred scriptures and protect him from an evil demon.",,"folklore, demon hunter",https://www.imdb.com/title/tt4591310/?ref_=ls_i_953,"https://m.media-amazon.com/images/M/MV5BMzRhMzg5MDYtNTk0Mi00MzIzLWI5MDQtMTBkM2M2NjkyMGJiXkEyXkFqcGc@._V1_QL75_UY207_CR4,0,140,207_.jpg",Soi Cheang,"Aaron Kwok, Gong Li, Shaofeng Feng"
X-Men: Apocalypse,2016,144,"Action, Adventure, Sci-Fi",PG-13,6.9,52.0,"459,491","543,934,105","In the 1980s the X-Men must defeat an ancient all-powerful mutant, En Sabah Nur, who intends to thrive through bringing destruction to the world.",246655.0,"mutant, supernatural powers, marvel comic, superhero, based on comic, superhuman, apocalypse, superhero team, world domination, aftercreditsstinger, 1980s",https://www.imdb.com/title/tt3385516/?ref_=ls_i_219,"https://m.media-amazon.com/images/M/MV5BNjVhNWY3NjItNmZjOS00NTU3LWFiZTctNzdjNGM5Y2Y0MDUwXkEyXkFqcGc@._V1_QL75_UX140_CR0,0,140,207_.jpg",Bryan Singer,"James McAvoy, Michael Fassbender, Jennifer Lawrence"
Captain America: Civil War,2016,147,"Action, Sci-Fi",PG-13,7.8,75.0,"846,697","1,155,046,416",Political involvement in the Avengers' affairs causes a rift between Captain America and Iron Man.,271110.0,"civil war, war, marvel comic, sequel, superhero, based on comic, imax, aftercreditsstinger, duringcreditsstinger, marvel cinematic universe, 3d",https://www.imdb.com/title/tt3498820/?ref_=ls_i_29,"https://m.media-amazon.com/images/M/MV5BMjQ0MTgyNjAxMV5BMl5BanBnXkFtZTgwNjUzMDkyODE@._V1_QL75_UX140_CR0,0,140,207_.jpg",Anthony Russo,"Chris Evans, Robert Downey Jr., Scarlett Johansson"
The Mermaid,2016,94,"Comedy, Drama, Fantasy",R,6.2,69.0,"10,121","553,810,228","Shan, a mermaid, is sent to assassinate Xuan, a developer who threatens the ecosystem of her race, but ends up falling in love with him instead.",381890.0,,https://www.imdb.com/title/tt4701660/?ref_=ls_i_209,"https://m.media-amazon.com/images/M/MV5BYWMzYThhODAtOWFlYS00OTdhLTkzM2ItZWU5NTRjMjZmMWMyXkEyXkFqcGc@._V1_QL75_UY207_CR4,0,140,207_.jpg",Stephen Chow,"Chao Deng, Show Lo, Yuqi Zhang"
Fantastic Beasts and Where to Find Them,2016,132,"Adventure, Family, Fantasy",PG-13,7.2,66.0,"506,224","816,037,575",The adventures of writer Newt Scamander in New York's secret community of witches and wizards seventy years before Harry Potter reads his book in school.,259316.0,"robbery, magic, teleportation, suitcase, new york city, subway station, central park, wizard, goblin, magical creature",https://www.imdb.com/title/tt3183660/?ref_=ls_i_101,"https://m.media-amazon.com/images/M/MV5BMjMxOTM1OTI4MV5BMl5BanBnXkFtZTgwODE5OTYxMDI@._V1_QL75_UX140_CR0,0,140,207_.jpg",David Yates,"Eddie Redmayne, Katherine Waterston, Alison Sudol"
Sing,2016,108,"Animation, Comedy, Family",PG,7.1,59.0,"190,199","634,338,384","In a city of humanoid animals, a hustling theater impresario's attempt to save his theater with a singing competition becomes grander than he anticipates even as its finalists find that their lives will never be the same.",427416.0,,https://www.imdb.com/title/tt3470600/?ref_=ls_i_169,"https://m.media-amazon.com/images/M/MV5BMTYzODYzODU2Ml5BMl5BanBnXkFtZTgwNTc1MTA2NzE@._V1_QL75_UX140_CR0,0,140,207_.jpg",Garth Jennings,"Matthew McConaughey, Reese Witherspoon, Seth MacFarlane"
Miss Peregrine's Home for Peculiar Children,2016,127,"Adventure, Drama, Family",PG-13,6.7,57.0,"187,522","296,482,446","When Jacob (Asa Butterfield) discovers clues to a mystery that stretches across time, he finds Miss Peregrine's Home for Peculiar Children. But the danger deepens after he gets to know the residents and learns about their special powers.",283366.0,"time travel, orphan, superpower",https://www.imdb.com/title/tt1935859/?ref_=ls_i_574,"https://m.media-amazon.com/images/M/MV5BMTU0Nzc5NzI5NV5BMl5BanBnXkFtZTgwNTk1MDE4MDI@._V1_QL75_UY207_CR13,0,140,207_.jpg",Tim Burton,"Eva Green, Asa Butterfield, Samuel L. Jackson"
Sully,2016,96,"Biography, Drama",PG-13,7.4,74.0,"296,871","243,870,033","When pilot Chesley ""Sully"" Sullenberger lands his damaged plane on the Hudson River in order to save the flight's passengers and crew, some consider him a hero while others think he was reckless.",363676.0,"new york, hero, bird, pilot, airplane, investigation, biography, based on true story, travel, rescue, aviation, airplane accident, based on memoir or autobiography, imax, hudson river",https://www.imdb.com/title/tt3263904/?ref_=ls_i_716,"https://m.media-amazon.com/images/M/MV5BYzM5ODA5MDItZGM4MS00YmQ3LTkxMDUtMDY2NjcyM2RmYzlkXkEyXkFqcGc@._V1_QL75_UX140_CR0,1,140,207_.jpg",Clint Eastwood,"Tom Hanks, Aaron Eckhart, Laura Linney"
Ice Age: Collision Course,2016,94,"Animation, Adventure, Comedy",PG,5.7,34.0,"74,462","408,754,975","When Scrat's acorn sends an asteroid to Earth, the Herd must find a way to stop the asteroid from hitting Earth with the help of a returning friend.",278154.0,"fire, ice, mammoth, fireworks, prehistoric, singing, critically bashed, cavemen, meteor crash",https://www.imdb.com/title/tt3416828/?ref_=ls_i_342,"https://m.media-amazon.com/images/M/MV5BMTUwMTk2ODc1OV5BMl5BanBnXkFtZTgwMzU4MzgzOTE@._V1_QL75_UX140_CR0,0,140,207_.jpg",Michael Thurmeier,"Ray Romano, Denis Leary, John Leguizamo"
Bridget Jones's Baby,2016,123,"Comedy, Drama, Romance",R,6.5,59.0,"81,988","211,952,420","Forty-something and single again, Bridget decides to focus on her job and surround herself with friends. Then she discovers that she is pregnant--but she is only 50% sure of the baby's father's identity.",95610.0,"love triangle, baby, sequel, pregnancy, unknown father, pregnant woman, childbirth, sitting on a toilet, woman director, ultrasound",https://www.imdb.com/title/tt1473832/?ref_=ls_i_854,"https://m.media-amazon.com/images/M/MV5BMWViMmNmNmEtYTg5Mi00Y2IwLTg4NzgtNzg2ZjNjY2RmYWZlXkEyXkFqcGc@._V1_QL75_UX140_CR0,0,140,207_.jpg",Sharon Maguire,"Renée Zellweger, Gemma Jones, Jim Broadbent"
The Conjuring 2,2016,134,"Horror, Mystery, Thriller",R,7.3,65.0,"298,890","322,811,541",Ed and Lorraine Warren travel to North London to help a single mother raising four children alone in a house plagued by a supernatural spirit.,259693.0,"london england, england, 1970s, spirit, single mother, demon, paranormal investigation, demonic possession, valak, annabelle",https://www.imdb.com/title/tt3065204/?ref_=ls_i_506,"https://m.media-amazon.com/images/M/MV5BOTRkMDlmZWEtMzQyYy00YzgyLTgwM2QtNzgxYmIwNGVlYmJlXkEyXkFqcGc@._V1_QL75_UX140_CR0,0,140,207_.jpg",James Wan,"Vera Farmiga, Patrick Wilson, Madison Wolfe"
Warcraft,2016,123,"Action, Adventure, Fantasy",PG-13,6.7,32.0,"277,861","439,048,914","As an Orc horde invades the planet Azeroth using a magic portal, a few human heroes and dissenting Orcs must attempt to stop the true evil behind this war.",68735.0,"video game, elves, orcs, magic, chase, based on comic, sorcerer, fictional war, based on video game, wizard, fictional language, muscles, orc, sword and sorcery",https://www.imdb.com/title/tt0803096/?ref_=ls_i_311,"https://m.media-amazon.com/images/M/MV5BMjIwNTM0Mzc5MV5BMl5BanBnXkFtZTgwMDk5NDU1ODE@._V1_QL75_UX140_CR0,7,140,207_.jpg",Duncan Jones,"Travis Fimmel, Paula Patton, Ben Foster"
Trolls,2016,92,"Animation, Adventure, Comedy",PG,6.4,55.0,"91,540","347,188,778","After the Bergens invade Troll Village, Poppy, the happiest Troll ever born, and the curmudgeonly Branch set off on a journey to rescue her friends.",136799.0,"based on toy, troll",https://www.imdb.com/title/tt1679335/?ref_=ls_i_462,"https://m.media-amazon.com/images/M/MV5BMTkxNDc3OTcxMV5BMl5BanBnXkFtZTgwODk2NjAzOTE@._V1_QL75_UX140_CR0,0,140,207_.jpg",Mike Mitchell,"Anna Kendrick, Justin Timberlake, Zooey Deschanel"
Me Before You,2016,110,"Drama, Romance",PG-13,7.4,51.0,"285,406","208,445,075",A girl in a small town forms an unlikely bond with a recently-paralyzed man she's taking care of.,296096.0,"england, based on novel, depression, small town, wheelchair, caretaker, caregiver, disabled, twenty something, woman director, romantic drama, dead end job, accident",https://www.imdb.com/title/tt2674426/?ref_=ls_i_872,"https://m.media-amazon.com/images/M/MV5BMTQ2NjE4NDE2NV5BMl5BanBnXkFtZTgwOTcwNDE5NzE@._V1_QL75_UX140_CR0,0,140,207_.jpg",Thea Sharrock,"Emilia Clarke, Sam Claflin, Janet McTeer"
