Name of movie,Year of release,Watchtime,Genre,Classification,Movie Rating,Metascore,Votes,Gross collection,Des,id,keywords,Link,img_src,Director,Stars
The Intouchables,2011,112,"Comedy, Drama",R,8.5,57.0,"924,776","426,588,510","After he becomes a quadriplegic from a paragliding accident, an aristocrat hires a young man from the projects to be his caregiver.",77338.0,"male friendship, masseuse, friendship, aristocrat, interracial friendship, unlikely friendship, duringcreditsstinger",https://www.imdb.com/title/tt1675434/?ref_=ls_i_321,"https://m.media-amazon.com/images/M/MV5BMTYxNDA3MDQwNl5BMl5BanBnXkFtZTcwNTU4Mzc1Nw@@._V1_QL75_UX140_CR0,0,140,207_.jpg",Olivier Nakache,"François Cluzet, Omar Sy, Anne Le Ny"
The Hangover Part II,2011,102,Comedy,R,6.5,44.0,"532,633","586,764,305","Two years after the bachelor party in Las Vegas, Phil, Stu, Alan, and Doug jet to Thailand for Stu's wedding. Stu's plan for a subdued pre-wedding brunch, however, goes seriously awry.",45243.0,"sun glasses, interpol, undercover cop, hangover, duringcreditsstinger",https://www.imdb.com/title/tt1411697/?ref_=ls_i_194,"https://m.media-amazon.com/images/M/MV5BMTM2MTM4MzY2OV5BMl5BanBnXkFtZTcwNjQ3NzI4NA@@._V1_QL75_UY207_CR0,0,140,207_.jpg",Todd Phillips,"Bradley Cooper, Zach Galifianakis, Ed Helms"
The Smurfs,2011,103,"Animation, Adventure, Comedy",PG,5.4,30.0,"96,411","563,749,323","When the evil wizard Gargamel chases the tiny blue Smurfs out of their village, they tumble from their magical world into New York City.",41513.0,"moon, magic, based on comic, animation, good vs evil, smurf, blue, vortex, mischief, cat and mouse, duringcreditsstinger",https://www.imdb.com/title/tt0472181/?ref_=ls_i_205,"https://m.media-amazon.com/images/M/MV5BNzQxNDYyNTQtYjg1OC00OGJiLTk2YjMtZjZjZDgwOWFlOTJjXkEyXkFqcGc@._V1_QL75_UX140_CR0,1,140,207_.jpg",Raja Gosnell,"Hank Azaria, Katy Perry, Jonathan Winters"
Cars 2,2011,106,"Animation, Adventure, Comedy",G,6.2,57.0,"216,175","559,852,396",Star race car Lightning McQueen and his pal Mater head overseas to compete in the World Grand Prix race. But the road to the championship becomes rocky as Mater gets caught up in an intriguing adventure of his own: international espionage.,49013.0,"car race, sequel, comedy, anthropomorphism, best friend, duringcreditsstinger",https://www.imdb.com/title/tt1216475/?ref_=ls_i_206,"https://m.media-amazon.com/images/M/MV5BMTUzNTc3MTU3M15BMl5BanBnXkFtZTcwMzIxNTc3NA@@._V1_QL75_UX140_CR0,0,140,207_.jpg",John Lasseter,"Owen Wilson, Larry the Cable Guy, Michael Caine"
Thor,2011,115,"Action, Fantasy",PG-13,7.0,57.0,"897,407","449,326,618","The powerful but arrogant god Thor is cast out of Asgard to live amongst humans in Midgard (Earth), where he soon becomes one of their finest defenders.",10195.0,"new mexico, banishment, shield, marvel comic, hammer, superhero, based on comic, redemption, norse mythology, aftercreditsstinger, marvel cinematic universe, 3d, asgard, odin, heimdall",https://www.imdb.com/title/tt0800369/?ref_=ls_i_298,"https://m.media-amazon.com/images/M/MV5BNjRhNGZjZjEtYTQzYS00OWUxLThjNGEtMTIwMTE2ZDFlZTZkXkEyXkFqcGc@._V1_QL75_UX140_CR0,0,140,207_.jpg",Kenneth Branagh,"Chris Hemsworth, Anthony Hopkins, Natalie Portman"
Sherlock Holmes: A Game of Shadows,2011,129,"Action, Adventure, Mystery",PG-13,7.4,48.0,"479,175","543,848,418","Detective Sherlock Holmes is on the trail of criminal mastermind Professor Moriarty, who is carrying out a string of random crimes across Europe.",58574.0,"detective inspector, steampunk, criminal mastermind",https://www.imdb.com/title/tt1515091/?ref_=ls_i_220,"https://m.media-amazon.com/images/M/MV5BMTQwMzQ5Njk1MF5BMl5BanBnXkFtZTcwNjIxNzIxNw@@._V1_QL75_UX140_CR0,0,140,207_.jpg",Guy Ritchie,"Robert Downey Jr., Jude Law, Jared Harris"
Mr. Popper's Penguins,2011,94,"Comedy, Family, Fantasy",PG,6.0,53.0,"105,277","187,361,754","The life of a businessman begins to change after he inherits six penguins, and as he transforms his apartment into a winter wonderland, his professional side starts to unravel.",58224.0,"taxi, restaurant, zoo, penguin, ex husband, little boy, zookeeper, doorman, ride, bird hatching, aftercreditsstinger, duringcreditsstinger",https://www.imdb.com/title/tt1396218/?ref_=ls_i_980,"https://m.media-amazon.com/images/M/MV5BMTcwMDI4NjEyOF5BMl5BanBnXkFtZTcwNzg5MzEwNQ@@._V1_QL75_UX140_CR0,0,140,207_.jpg",Mark Waters,"Jim Carrey, Carla Gugino, Angela Lansbury"
Gnomeo & Juliet,2011,84,"Animation, Adventure, Comedy",G,5.9,53.0,"59,473","193,967,670","Separated by a garden fence and a feud, are blue gnomes on one side and red gnomes on the other. This doesn't stop blue Gnomeo and red Juliet from falling in love with each other. Do they have a future together?",45772.0,"shakespeare, garden, forbidden love, kiss, garden gnome, orchid, love, based on play or musical, red",https://www.imdb.com/title/tt0377981/?ref_=ls_i_949,"https://m.media-amazon.com/images/M/MV5BMjAyNDM2MDA2NF5BMl5BanBnXkFtZTcwOTMxMDAxNA@@._V1_QL75_UX140_CR0,0,140,207_.jpg",Kelly Asbury,"James McAvoy, Emily Blunt, Maggie Smith"
X-Men: First Class,2011,131,"Action, Sci-Fi",PG-13,7.7,65.0,"721,659","352,616,690","In the 1960s, superpowered humans Charles Xavier and Erik Lensherr work together to find others like them, but Erik's vengeful pursuit of an ambitious mutant who ruined his life causes a schism to divide them.",49538.0,"cia, mutant, mine, marvel comic, superhero, based on comic, superhuman, historical fiction, nuclear war, cuban missile crisis, world war iii, 1960s",https://www.imdb.com/title/tt1270798/?ref_=ls_i_445,"https://m.media-amazon.com/images/M/MV5BMTg5OTMxNzk4Nl5BMl5BanBnXkFtZTcwOTk1MjAwNQ@@._V1_QL75_UX140_CR0,0,140,207_.jpg",Matthew Vaughn,"James McAvoy, Michael Fassbender, Jennifer Lawrence"
Rise of the Planet of the Apes,2011,105,"Action, Drama, Sci-Fi",PG-13,7.6,68.0,"556,049","481,800,873",A substance designed to help the brain repair itself gives advanced intelligence to a chimpanzee who leads an ape uprising.,61791.0,"intelligence, zoo, cage, dystopia, golden gate bridge, ape, monkey, medical research, alzheimer's disease",https://www.imdb.com/title/tt1318514/?ref_=ls_i_263,"https://m.media-amazon.com/images/M/MV5BMjllODU1NDItODU1Ni00N2Y2LTg4Y2ItOTJjMTczZDliN2FhXkEyXkFqcGc@._V1_QL75_UY207_CR0,0,140,207_.jpg",Rupert Wyatt,"James Franco, Andy Serkis, Freida Pinto"
Rio,2011,96,"Animation, Adventure, Comedy",G,6.9,63.0,"247,421","483,866,772","When Blu, a domesticated macaw from small-town Minnesota, meets the fiercely independent Jewel, he takes off on an adventure to Rio de Janeiro with the bird of his dreams.",46195.0,"brazil, pet, bird, musical, canary, samba, animal, duringcreditsstinger, rio 1, río 1",https://www.imdb.com/title/tt1436562/?ref_=ls_i_260,"https://m.media-amazon.com/images/M/MV5BMTU2MDY3MzAzMl5BMl5BanBnXkFtZTcwMTg0NjM5NA@@._V1_QL75_UX140_CR0,0,140,207_.jpg",Carlos Saldanha,"Jesse Eisenberg, Anne Hathaway, George Lopez"
Puss in Boots,2011,90,"Animation, Action, Adventure",PG,6.6,65.0,"191,306","554,987,477","An outlaw cat, his childhood egg-friend, and a seductive thief kitty set out in search for the eggs of the fabled Golden Goose to clear his name, restore his lost honor, and regain the trust of his mother and town.",,"revenge, murder, on the run, fugitive, framed, father daughter relationship, framed for murder",https://www.imdb.com/title/tt0448694/?ref_=ls_i_208,"https://m.media-amazon.com/images/M/MV5BOTQwMGU5YTEtYmQzMy00MTM0LWFhNzAtOGY2Yzc1MzBkYTYyXkEyXkFqcGc@._V1_QL75_UX140_CR0,1,140,207_.jpg",Chris Miller,"Antonio Banderas, Salma Hayek, Zach Galifianakis"
Mission: Impossible - Ghost Protocol,2011,132,"Action, Adventure, Thriller",PG-13,7.4,73.0,"527,097","694,713,380","The IMF is shut down when it's implicated in the bombing of the Kremlin, causing Ethan Hunt and his new team to go rogue to clear their organization's name.",56292.0,"fight, sequel, mission, explosion, broken arm, imax, nuclear threat",https://www.imdb.com/title/tt1229238/?ref_=ls_i_149,"https://m.media-amazon.com/images/M/MV5BMTY4MTUxMjQ5OV5BMl5BanBnXkFtZTcwNTUyMzg5Ng@@._V1_QL75_UX140_CR0,0,140,207_.jpg",Brad Bird,"Tom Cruise, Jeremy Renner, Simon Pegg"
The Twilight Saga: Eclipse,2010,124,"Action, Adventure, Drama",PG-13,5.1,58.0,"260,003","698,509,825","As a string of mysterious killings grips Seattle, Bella, whose high school graduation is fast approaching, is forced to choose between her love for vampire Edward and her friendship with werewolf Jacob.",24021.0,"vampire, graduation, bite, immortality, werewolf, fang vamp",https://www.imdb.com/title/tt1325004/?ref_=ls_i_147,"https://m.media-amazon.com/images/M/MV5BNDMwNjAzNzYwOF5BMl5BanBnXkFtZTcwMDY5NzcyMw@@._V1_QL75_UY207_CR0,0,140,207_.jpg",David Slade,"Kristen Stewart, Robert Pattinson, Taylor Lautner"
The Karate Kid,2010,140,"Action, Drama, Family",PG,6.2,61.0,"204,456","359,126,022","Work causes a single mother to move to China with her young son; in his new home, the boy embraces kung fu, taught to him by a master.",38575.0,duringcreditsstinger,https://www.imdb.com/title/tt1155076/?ref_=ls_i_430,"https://m.media-amazon.com/images/M/MV5BMjI0NDMyZTMtOWFlMC00NjJlLTgwZDYtZWJiOGQ0YWQ2YTZhXkEyXkFqcGc@._V1_QL75_UX140_CR0,0,140,207_.jpg",Harald Zwart,"Jackie Chan, Jaden Smith, Taraji P. Henson"
Shrek Forever After,2010,93,"Animation, Adventure, Comedy",PG,6.3,58.0,"223,647","752,600,867",Rumpelstiltskin tricks a mid-life crisis burdened Shrek into allowing himself to be erased from existence and cast in a dark alternate timeline where Rumpelstiltskin rules supreme.,10192.0,"ogre, 3d",https://www.imdb.com/title/tt0892791/?ref_=ls_i_126,"https://m.media-amazon.com/images/M/MV5BMTY0OTU1NzkxMl5BMl5BanBnXkFtZTcwMzI2NDUzMw@@._V1_QL75_UX140_CR0,0,140,207_.jpg",Mike Mitchell,"Mike Myers, Cameron Diaz, Eddie Murphy"
Percy Jackson & the Olympians: The Lightning Thief,2010,118,"Adventure, Family, Fantasy",PG,5.9,47.0,"202,468","226,497,209",A teenager discovers he's the descendant of a Greek god and sets out on an adventure to settle an on-going battle between the gods.,32657.0,"monster, greek mythology, god, poseidon  , lightning bolt, based on young adult novel",https://www.imdb.com/title/tt0814255/?ref_=ls_i_780,"https://m.media-amazon.com/images/M/MV5BZDE4M2ZiYzEtODJiZC00NmI1LWFlNTgtOGJlNTY3NmExYWNjXkEyXkFqcGc@._V1_QL75_UX140_CR0,0,140,207_.jpg",Chris Columbus,"Logan Lerman, Kevin McKidd, Steve Coogan"
Eat Pray Love,2010,133,"Biography, Drama, Romance",PG-13,5.8,50.0,"105,499","204,594,016","A married woman realizes how unhappy her marriage really is, and that her life needs to go in a different direction. After a painful divorce, she takes off on a round-the-world journey to ""find herself"".",38167.0,"indonesia, female protagonist, india, divorce, bali",https://www.imdb.com/title/tt0879870/?ref_=ls_i_898,"https://m.media-amazon.com/images/M/MV5BMTY5NDkyNzkyM15BMl5BanBnXkFtZTcwNDQyNDk0Mw@@._V1_QL75_UX140_CR0,0,140,207_.jpg",Ryan Murphy,"Julia Roberts, Javier Bardem, Richard Jenkins"
Gulliver's Travels,2010,85,"Adventure, Comedy, Family",PG,4.9,33.0,"73,368","237,382,724","Travel writer Lemuel Gulliver takes an assignment in Bermuda but ends up on the island of Lilliput, where he towers over its tiny citizens.",38745.0,"journalist, forbidden love, princess, royal court, 3d",https://www.imdb.com/title/tt1320261/?ref_=ls_i_736,"https://m.media-amazon.com/images/M/MV5BMjI1NDU1MjcxN15BMl5BanBnXkFtZTcwODczNTM1Mw@@._V1_QL75_UX140_CR0,0,140,207_.jpg",Rob Letterman,"Jack Black, Emily Blunt, Jason Segel"
Tron: Legacy,2010,125,"Action, Adventure, Sci-Fi",PG,6.8,49.0,"354,949","400,063,852",The son of a virtual world designer goes looking for his father and ends up inside the digital world that his father designed. He meets his father's corrupted creation and a unique ally who was born inside the digital world.,,"based on graphic novel, homework, shot in the chin, soft boiled egg, learning to drive, spoiled son, scarred face, thompson sub machine gun, frost on a window, cauterizing a wound, liberty half dollar",https://www.imdb.com/title/tt1104001/?ref_=ls_i_340,"https://m.media-amazon.com/images/M/MV5BMTk4NTk4MTk1OF5BMl5BanBnXkFtZTcwNTE2MDIwNA@@._V1_QL75_UX140_CR0,0,140,207_.jpg",Joseph Kosinski,"Jeff Bridges, Garrett Hedlund, Olivia Wilde"
Iron Man 2,2010,124,"Action, Sci-Fi",PG-13,6.9,57.0,"865,539","623,933,331","With the world now aware of his identity as Iron Man, Tony Stark must contend with both his declining health and a vengeful mad man with ties to his father's legacy.",10138.0,"malibu, marvel comic, superhero, based on comic, revenge, aftercreditsstinger, marvel cinematic universe",https://www.imdb.com/title/tt1228705/?ref_=ls_i_176,"https://m.media-amazon.com/images/M/MV5BYWYyOGQzOGYtMGQ1My00ZWYxLTgzZjktZWYzN2IwYjkxYzM0XkEyXkFqcGc@._V1_QL75_UY207_CR0,0,140,207_.jpg",Jon Favreau,"Robert Downey Jr., Mickey Rourke, Gwyneth Paltrow"
The Chronicles of Narnia: The Voyage of the Dawn Treader,2010,113,"Adventure, Family, Fantasy",PG,6.3,53.0,"165,849","415,686,217","Lucy and Edmund Pevensie return to Narnia with their cousin Eustace where they meet up with Prince Caspian for a trip across the sea aboard the royal ship The Dawn Treader. Along the way they encounter dragons, dwarves, merfolk, and a band of lost warriors before reaching the edge of the world.",10140.0,"based on novel, magic, good vs evil, king, narnia, fantasy world, knife held to throat, snowing, quest",https://www.imdb.com/title/tt0980970/?ref_=ls_i_331,"https://m.media-amazon.com/images/M/MV5BOTMwNjNmNDgtYWFhMi00NjRhLTk5YjAtMjNjYTVkYjQwOWQwXkEyXkFqcGc@._V1_QL75_UX140_CR0,1,140,207_.jpg",Michael Apted,"Ben Barnes, Skandar Keynes, Georgie Henley"
Tangled,2010,100,"Animation, Adventure, Comedy",PG,7.7,71.0,"491,823","592,462,816","The magically long-haired Rapunzel has spent her entire life in a tower, but now that a runaway thief has stumbled upon her, she is about to discover the world for the first time, and who she really is.",38757.0,"hostage, magic, horse, fairy tale, musical, princess, animation, tower, blonde woman, selfishness, healing power, based on fairy tale, duringcreditsstinger, healing gift, animal sidekick",https://www.imdb.com/title/tt0398286/?ref_=ls_i_190,"https://m.media-amazon.com/images/M/MV5BMTAxNDYxMjg0MjNeQTJeQWpwZ15BbWU3MDcyNTk2OTM@._V1_QL75_UX140_CR0,0,140,207_.jpg",Nathan Greno,"Mandy Moore, Zachary Levi, Donna Murphy"
Despicable Me,2010,95,"Animation, Adventure, Comedy",PG,7.6,72.0,"582,153","543,157,985","Gru, a criminal mastermind, adopts three orphans as pawns to carry out the biggest heist in history. His life takes an unexpected turn when the little girls see the evildoer as their potential father.",20352.0,"adoptive father, orphanage, life's dream, rivalry, stealing, ballet, little girl, orphan, father daughter relationship, tomboy, mother son relationship, intelligent, kids, evil doctor, duringcreditsstinger, minions, supervillain, 3d, despicable, cattivissimo",https://www.imdb.com/title/tt1323594/?ref_=ls_i_218,"https://m.media-amazon.com/images/M/MV5BMTY3NjY0MTQ0Nl5BMl5BanBnXkFtZTcwMzQ2MTc0Mw@@._V1_QL75_UX140_CR0,0,140,207_.jpg",Pierre Coffin,"Steve Carell, Jason Segel, Russell Brand"
The King's Speech,2010,118,"Biography, Drama, History",R,8.0,88.0,"706,511","484,068,861","The story of King George VI, his unexpected ascension to the throne of the British Empire in 1936, and the speech therapist who helped the unsure monarch overcome his stammer.",45269.0,"great britain, radio, monarchy, radio transmission, royal family, speech, marriage, royalty, death of father",https://www.imdb.com/title/tt1504320/?ref_=ls_i_274,"https://m.media-amazon.com/images/M/MV5BMzU5MjEwMTg2Nl5BMl5BanBnXkFtZTcwNzM3MTYxNA@@._V1_QL75_UY207_CR1,0,140,207_.jpg",Tom Hooper,"Colin Firth, Geoffrey Rush, Helena Bonham Carter"
Clash of the Titans,2010,106,"Action, Adventure, Fantasy",PG-13,5.8,39.0,"292,194","493,214,993","Perseus, a demigod and the son of Zeus, battles the minions of Hades and the Underworld in order to stop them from conquering Olympus and Earth.",18823.0,"hades, mythology, greek mythology, zeus, medusa, mythological beast, sea monster, perseus, kraken, gods, ancient greece, based on myths or folklore, 3d",https://www.imdb.com/title/tt0800320/?ref_=ls_i_252,"https://m.media-amazon.com/images/M/MV5BMTYxNjg4MzU5OV5BMl5BanBnXkFtZTcwOTA3NTUwMw@@._V1_QL75_UX140_CR0,0,140,207_.jpg",Louis Leterrier,"Sam Worthington, Liam Neeson, Ralph Fiennes"
Inception,2010,148,"Action, Adventure, Sci-Fi",PG-13,8.8,74.0,"2,538,374","839,030,630","A thief who steals corporate secrets through the use of dream-sharing technology is given the inverse task of planting an idea into the mind of a C.E.O., but his tragic past may doom the project and his team to disaster.",27205.0,"loss of lover, dream, kidnapping, sleep, subconsciousness, heist, redemption, female hero",https://www.imdb.com/title/tt1375666/?ref_=ls_i_95,"https://m.media-amazon.com/images/M/MV5BMjAxMzY3NjcxNF5BMl5BanBnXkFtZTcwNTI5OTM0Mw@@._V1_QL75_UX140_CR0,0,140,207_.jpg",Christopher Nolan,"Leonardo DiCaprio, Joseph Gordon-Levitt, Elliot Page"
Harry Potter and the Deathly Hallows: Part 1,2010,146,"Adventure, Family, Fantasy",PG-13,7.7,65.0,"596,615","972,584,232","As Harry, Ron and Hermione race against time and evil to destroy the Horcruxes, they uncover the existence of the three most powerful objects in the wizarding world: the Deathly Hallows.",12444.0,"corruption, isolation, radio, magic, teleportation, bravery, tension, attack, werewolf",https://www.imdb.com/title/tt0926084/?ref_=ls_i_63,"https://m.media-amazon.com/images/M/MV5BMTQ2OTE1Mjk0N15BMl5BanBnXkFtZTcwODE3MDAwNA@@._V1_QL75_UY207_CR0,0,140,207_.jpg",David Yates,"Daniel Radcliffe, Emma Watson, Rupert Grint"
The Social Network,2010,120,"Biography, Drama",PG-13,7.8,95.0,"755,497","224,920,375","As Harvard student Mark Zuckerberg creates the social networking site that would become known as Facebook, he is sued by the twins who claimed he stole their idea and by the co-founder who was later squeezed out of the business.",37799.0,"hacker, hacking, creator, frat party, social network, deposition, intellectual property, entrepreneur, arrogance, young entrepreneur, facebook",https://www.imdb.com/title/tt1285016/?ref_=ls_i_787,"https://m.media-amazon.com/images/M/MV5BMjlkNTE5ZTUtNGEwNy00MGVhLThmZjMtZjU1NDE5Zjk1NDZkXkEyXkFqcGc@._V1_QL75_UX140_CR0,0,140,207_.jpg",David Fincher,"Jesse Eisenberg, Andrew Garfield, Justin Timberlake"
The Sorcerer's Apprentice,2010,109,"Action, Adventure, Family",PG,6.1,46.0,"169,657","215,283,742",A protege of the magician Merlin must train his teacher's successor - an introverted but resourceful physics prodigy - in the art of sorcery to prevent the return of Morgana le Fay.,27022.0,"witch, fire, wolf, fountain, magic, book, castle, water, apprentice, training, merlin, love, mission, sorcerer, dragon, aftercreditsstinger, apprendista, morgana",https://www.imdb.com/title/tt0963966/?ref_=ls_i_836,"https://m.media-amazon.com/images/M/MV5BM2Y0MGJhZTAtYjBkNS00MmM4LWJmOWYtNjQ3ZTFlMmRhZGY0XkEyXkFqcGc@._V1_QL75_UY207_CR0,0,140,207_.jpg",Jon Turteltaub,"Nicolas Cage, Jay Baruchel, Alfred Molina"
Grown Ups,2010,102,Comedy,PG-13,6.0,30.0,"274,475","271,457,301","After their high school basketball coach passes away, five good friends and former teammates reunite for a Fourth of July holiday weekend.",38365.0,"overweight, swing, foot, convertible, arrow",https://www.imdb.com/title/tt1375670/?ref_=ls_i_623,"https://m.media-amazon.com/images/M/MV5BMjA0ODYwNzU5Nl5BMl5BanBnXkFtZTcwNTI1MTgxMw@@._V1_QL75_UX140_CR0,0,140,207_.jpg",Dennis Dugan,"Adam Sandler, Salma Hayek, Kevin James"
RED,2010,111,"Action, Comedy, Crime",PG-13,7.0,60.0,"323,330","199,006,387","When his peaceful life is threatened by a high-tech assassin, former black-ops agent Frank Moses reassembles his old team in a last-ditch effort to survive and uncover his assailants.",39514.0,"cia, retirement, shot to death, sniper rifle, retired, female spy, alarm",https://www.imdb.com/title/tt1245526/?ref_=ls_i_922,"https://m.media-amazon.com/images/M/MV5BMzg2Mjg1OTk0NF5BMl5BanBnXkFtZTcwMjQ4MTA3Mw@@._V1_QL75_UX140_CR0,0,140,207_.jpg",Robert Schwentke,"Bruce Willis, Helen Mirren, Morgan Freeman"
The Expendables,2010,103,"Action, Adventure, Thriller",R,6.4,45.0,"363,813","274,470,394",A CIA operative hires a team of mercenaries to eliminate a Latin dictator and a renegade CIA agent.,27578.0,"tattoo, martial arts, sniper, island, mercenary, bridge, rescue, escape, church, drug, blade, ensemble cast, duringcreditsstinger",https://www.imdb.com/title/tt1320253/?ref_=ls_i_616,"https://m.media-amazon.com/images/M/MV5BNTUwODQyNjM0NF5BMl5BanBnXkFtZTcwNDMwMTU1Mw@@._V1_QL75_UX140_CR0,0,140,207_.jpg",Sylvester Stallone,"Sylvester Stallone, Jason Statham, Jet Li"
The Tourist,2010,103,"Action, Thriller",PG-13,6.0,37.0,"255,932","278,780,441","Revolves around Frank, an American tourist visiting Italy to mend a broken heart. Elise is an extraordinary woman who deliberately crosses his path.",37710.0,"paris, hotel, false identity, undercover agent, romance",https://www.imdb.com/title/tt1243957/?ref_=ls_i_604,"https://m.media-amazon.com/images/M/MV5BMTMyMzc3OTkwMV5BMl5BanBnXkFtZTcwMjc0MTgwNA@@._V1_QL75_UX140_CR0,0,140,207_.jpg",Florian Henckel von Donnersmarck,"Johnny Depp, Angelina Jolie, Paul Bettany"
Sex and the City 2,2010,146,"Comedy, Drama, Romance",R,4.5,27.0,"83,840","290,745,055","While wrestling with the pressures of life, love, and work in Manhattan, Carrie, Miranda, and Charlotte join Samantha for a trip to Abu Dhabi (United Arab Emirates), where Samantha's ex is filming a new movie.",37786.0,,https://www.imdb.com/title/tt1261945/?ref_=ls_i_587,"https://m.media-amazon.com/images/M/MV5BMTM3OTUyNTI3MF5BMl5BanBnXkFtZTcwODcyMzM0Mw@@._V1_QL75_UX140_CR0,10,140,207_.jpg",Michael Patrick King,"Sarah Jessica Parker, Kim Cattrall, Kristin Davis"
Knight and Day,2010,109,"Action, Adventure, Comedy",PG-13,6.3,46.0,"209,905","261,989,769",A young woman gets mixed up with a disgraced spy who is trying to clear his name.,37834.0,"spy, airport, gas station, garage, pilot, chase, secret agent, rope, exploding building, car chase, police car, boy genius, duringcreditsstinger",https://www.imdb.com/title/tt1013743/?ref_=ls_i_650,"https://m.media-amazon.com/images/M/MV5BMTM0Mzg0MzI3Ml5BMl5BanBnXkFtZTcwNjIyNzk1Mw@@._V1_QL75_UY207_CR0,0,140,207_.jpg",James Mangold,"Tom Cruise, Cameron Diaz, Peter Sarsgaard"
Due Date,2010,95,"Comedy, Drama",R,6.5,51.0,"357,284","211,780,824",High-strung father-to-be Peter Highman is forced to hitch a ride with aspiring actor Ethan Tremblay on a road trip in order to make it to his child's birth on time.,41733.0,"highway, slacker, hitchhiker, wallet, sunglasses, rest stop, vicodin, waffle",https://www.imdb.com/title/tt1231583/?ref_=ls_i_858,"https://m.media-amazon.com/images/M/MV5BMTU5MTgxODM3Nl5BMl5BanBnXkFtZTcwMjMxNDEwNA@@._V1_QL75_UX140_CR0,0,140,207_.jpg",Todd Phillips,"Robert Downey Jr., Zach Galifianakis, Michelle Monaghan"
Salt,2010,100,"Action, Thriller",PG-13,6.4,65.0,"329,458","293,503,354",A CIA agent goes on the run after a defector accuses her of being a Russian spy.,27576.0,"assassination, spy, cia, kidnapping, cold war, soviet union, double agent, race against time, revenge, on the run, shootout, espionage, female protagonist, hitwoman, terrorism, violence, russian spy, intelligence officer, action heroine",https://www.imdb.com/title/tt0944835/?ref_=ls_i_580,"https://m.media-amazon.com/images/M/MV5BMjIyODA2NDg4NV5BMl5BanBnXkFtZTcwMjg4NDAwMw@@._V1_QL75_UX140_CR0,0,140,207_.jpg",Phillip Noyce,"Angelina Jolie, Liev Schreiber, Chiwetel Ejiofor"
Shutter Island,2010,138,"Drama, Mystery, Thriller",R,8.2,63.0,"1,447,430","294,805,697","Teddy Daniels and Chuck Aule, two US marshals, are sent to an asylum on a remote island in order to investigate the disappearance of a patient, where Teddy uncovers a shocking truth about the place.",11324.0,"based on novel, island, hurricane, investigation, psychiatric hospital, u.s. marshal, conspiracy theory, 1950s",https://www.imdb.com/title/tt1130884/?ref_=ls_i_577,"https://m.media-amazon.com/images/M/MV5BN2FjNWExYzEtY2YzOC00YjNlLTllMTQtNmIwM2Q1YzBhOWM1XkEyXkFqcGc@._V1_QL75_UX140_CR0,0,140,207_.jpg",Martin Scorsese,"Leonardo DiCaprio, Emily Mortimer, Mark Ruffalo"
Prince of Persia: The Sands of Time,2010,116,"Action, Adventure, Fantasy",PG-13,6.6,50.0,"303,172","336,365,676",A young fugitive prince and princess must stop a villain who unknowingly threatens to destroy the world with a special dagger that enables the magic sand inside to reverse time.,9543.0,"persia, sandstorm, brother against brother, armageddon, regent, based on video game",https://www.imdb.com/title/tt0473075/?ref_=ls_i_477,"https://m.media-amazon.com/images/M/MV5BMTMwNDg0NzcyMV5BMl5BanBnXkFtZTcwNjg4MjQyMw@@._V1_QL75_UY207_CR0,0,140,207_.jpg",Mike Newell,"Jake Gyllenhaal, Gemma Arterton, Ben Kingsley"
Resident Evil: Afterlife,2010,96,"Action, Horror, Sci-Fi",R,5.8,37.0,"178,748","300,228,084","While still out to destroy the evil Umbrella Corporation, Alice joins a group of survivors living in a prison surrounded by the infected who also want to relocate to the mysterious but supposedly unharmed safe haven known only as Arcadia.",35791.0,"post-apocalyptic, dystopia, undead, biohazard, evil corporation, resident evil, zombie, based on video game, duringcreditsstinger, 3d",https://www.imdb.com/title/tt1220634/?ref_=ls_i_559,"https://m.media-amazon.com/images/M/MV5BNTgyZmNmNjctMTdlNC00NjEzLWIwZjAtYzRmNGQzYWIzOGFmXkEyXkFqcGc@._V1_QL75_UX140_CR0,0,140,207_.jpg",Paul W.S. Anderson,"Milla Jovovich, Ali Larter, Wentworth Miller"
